"843","Altari Alloy Chair","Lorem Ipsum is simply dummy text of the printing and typesetting industry. Lorem Ipsum has been the industry's standard dummy.","[{""section_name"":""Product - Other Description"",""section_slug"":""product-other-description"",""inner-list"":[{""field_name"":""Other Description"",""field_slug"":""product-other-description-other-description"",""field_help_text"":""Please add your description text here"",""field_default_text"":""Praesent sapien massa, convallis a pellentesque nec, egestas non nisi. Sed porttitor lectus nibh. Pellentesque in ipsum id orci porta dapibus. Praesent sapien massa, convallis a pellentesque nec, egestas non nisi. Curabitur non nulla sit amet nisl tempus convallis quis ac lectus. Sed porttitor lectus nibh. Nulla quis lorem ut libero malesuada feugiat. Curabitur arcu erat, accumsan id imperdiet et, porttitor at sem. Vivamus suscipit tortor eget felis porttitor volutpat. Nulla quis lorem ut libero malesuada feugiat."",""field_type"":""text area"",""value"":""Praesent sapien massa, convallis a pellentesque nec, egestas non nisi. Sed porttitor lectus nibh. Pellentesque in ipsum id orci porta dapibus. Praesent sapien massa, convallis a pellentesque nec, egestas non nisi. Curabitur non nulla sit amet nisl tempus convallis quis ac lectus. Sed porttitor lectus nibh. Nulla quis lorem ut libero malesuada feugiat. Curabitur arcu erat, accumsan id imperdiet et, porttitor at sem. Vivamus suscipit tortor eget felis porttitor volutpat. Nulla quis lorem ut libero malesuada feugiat.""},{""field_name"":""Other Description Image"",""field_slug"":""product-other-description-other-description-image"",""field_help_text"":""Upload image here"",""field_default_text"":""Upload image here"",""field_type"":""photo upload"",""value"":""themes\/furnituremobileapp\/uploads\/17320221213_1670927090.png"",""image_path"":""themes\/furnituremobileapp\/uploads\/17320221213_1670927090.png""},{""field_name"":""More informations"",""field_slug"":""product-other-description-more-informations"",""field_help_text"":""Please add your description text here"",""field_default_text"":""Praesent sapien massa, convallis a pellentesque nec, egestas non nisi. Sed porttitor lectus nibh. Pellentesque in ipsum id orci porta dapibus. Praesent sapien massa, convallis a pellentesque nec, egestas non nisi. Curabitur non nulla sit amet nisl tempus convallis quis ac lectus. Sed porttitor lectus nibh. Nulla quis lorem ut libero malesuada feugiat. Curabitur arcu erat, accumsan id imperdiet et, porttitor at sem. Vivamus suscipit tortor eget felis porttitor volutpat. Nulla quis lorem ut libero malesuada feugiat."",""field_type"":""text area"",""value"":""Praesent sapien massa, convallis a pellentesque nec, egestas non nisi. Sed porttitor lectus nibh. Pellentesque in ipsum id orci porta dapibus. Praesent sapien massa, convallis a pellentesque nec, egestas non nisi. Curabitur non nulla sit amet nisl tempus convallis quis ac lectus. Sed porttitor lectus nibh. Nulla quis lorem ut libero malesuada feugiat. Curabitur arcu erat, accumsan id imperdiet et, porttitor at sem. Vivamus suscipit tortor eget felis porttitor volutpat. Nulla quis lorem ut libero malesuada feugiat.""},{""field_name"":""More information Image"",""field_slug"":""product-other-description-more-information-image"",""field_help_text"":""Upload image here"",""field_default_text"":""Upload image here"",""field_type"":""photo upload"",""value"":""themes\/furnituremobileapp\/uploads\/35620221213_1670927090.png"",""image_path"":""themes\/furnituremobileapp\/uploads\/35620221213_1670927090.png""}]}]","{""product-other-description"":[{""field_type"":""text area"",""name"":""Other Description"",""value"":""Praesent sapien massa, convallis a pellentesque nec, egestas non nisi. Sed porttitor lectus nibh. Pellentesque in ipsum id orci porta dapibus. Praesent sapien massa, convallis a pellentesque nec, egestas non nisi. Curabitur non nulla sit amet nisl tempus convallis quis ac lectus. Sed porttitor lectus nibh. Nulla quis lorem ut libero malesuada feugiat. Curabitur arcu erat, accumsan id imperdiet et, porttitor at sem. Vivamus suscipit tortor eget felis porttitor volutpat. Nulla quis lorem ut libero malesuada feugiat.""},{""field_type"":""photo upload"",""name"":""Other Description Image"",""value"":""themes\/furnituremobileapp\/uploads\/17320221213_1670927090.png""},{""field_type"":""text area"",""name"":""More informations"",""value"":""Praesent sapien massa, convallis a pellentesque nec, egestas non nisi. Sed porttitor lectus nibh. Pellentesque in ipsum id orci porta dapibus. Praesent sapien massa, convallis a pellentesque nec, egestas non nisi. Curabitur non nulla sit amet nisl tempus convallis quis ac lectus. Sed porttitor lectus nibh. Nulla quis lorem ut libero malesuada feugiat. Curabitur arcu erat, accumsan id imperdiet et, porttitor at sem. Vivamus suscipit tortor eget felis porttitor volutpat. Nulla quis lorem ut libero malesuada feugiat.""},{""field_type"":""photo upload"",""name"":""More information Image"",""value"":""themes\/furnituremobileapp\/uploads\/35620221213_1670927090.png""}]}","[{""section_name"":""Product Tag"",""section_slug"":""product-tag"",""inner-list"":[{""field_name"":""new"",""field_slug"":""product-tag-new"",""field_help_text"":""new"",""field_default_text"":""new"",""field_type"":""radio""},{""field_name"":""best seller"",""field_slug"":""product-tag-best-seller"",""field_help_text"":""best seller"",""field_default_text"":""best seller"",""field_type"":""radio""},{""field_name"":""None"",""field_slug"":""product-tag-none"",""field_help_text"":""None"",""field_default_text"":""None"",""field_type"":""radio""}],""value"":""best seller""}]","best seller","81","0","themes/homedecor/uploads/03820221213_1670927090.png","https://apps.rajodiya.com/ecommerce/themes/homedecor/uploads/03820221213_1670927090.png","0.00","percentage","1.00","168","1","[""50""]","[{""attribute_id"":""50"",""values"":[""gray""]}]","1342","1","1.00","Altari Alloy Chair","homedecor","0",,,"2023-01-19 07:07:03","2023-01-19 07:07:03"
"844","Armless Swivel Desk Chair","Lorem Ipsum is simply dummy text of the printing and typesetting industry. Lorem Ipsum has been the industry's standard dummy.","[{""section_name"":""Product - Other Description"",""section_slug"":""product-other-description"",""inner-list"":[{""field_name"":""Other Description"",""field_slug"":""product-other-description-other-description"",""field_help_text"":""Please add your description text here"",""field_default_text"":""Praesent sapien massa, convallis a pellentesque nec, egestas non nisi. Sed porttitor lectus nibh. Pellentesque in ipsum id orci porta dapibus. Praesent sapien massa, convallis a pellentesque nec, egestas non nisi. Curabitur non nulla sit amet nisl tempus convallis quis ac lectus. Sed porttitor lectus nibh. Nulla quis lorem ut libero malesuada feugiat. Curabitur arcu erat, accumsan id imperdiet et, porttitor at sem. Vivamus suscipit tortor eget felis porttitor volutpat. Nulla quis lorem ut libero malesuada feugiat."",""field_type"":""text area"",""value"":""Praesent sapien massa, convallis a pellentesque nec, egestas non nisi. Sed porttitor lectus nibh. Pellentesque in ipsum id orci porta dapibus. Praesent sapien massa, convallis a pellentesque nec, egestas non nisi. Curabitur non nulla sit amet nisl tempus convallis quis ac lectus. Sed porttitor lectus nibh. Nulla quis lorem ut libero malesuada feugiat. Curabitur arcu erat, accumsan id imperdiet et, porttitor at sem. Vivamus suscipit tortor eget felis porttitor volutpat. Nulla quis lorem ut libero malesuada feugiat.""},{""field_name"":""Other Description Image"",""field_slug"":""product-other-description-other-description-image"",""field_help_text"":""Upload image here"",""field_default_text"":""Upload image here"",""field_type"":""photo upload"",""value"":""themes\/furnituremobileapp\/uploads\/11720221213_1670927150.png"",""image_path"":""themes\/furnituremobileapp\/uploads\/11720221213_1670927150.png""},{""field_name"":""More informations"",""field_slug"":""product-other-description-more-informations"",""field_help_text"":""Please add your description text here"",""field_default_text"":""Praesent sapien massa, convallis a pellentesque nec, egestas non nisi. Sed porttitor lectus nibh. Pellentesque in ipsum id orci porta dapibus. Praesent sapien massa, convallis a pellentesque nec, egestas non nisi. Curabitur non nulla sit amet nisl tempus convallis quis ac lectus. Sed porttitor lectus nibh. Nulla quis lorem ut libero malesuada feugiat. Curabitur arcu erat, accumsan id imperdiet et, porttitor at sem. Vivamus suscipit tortor eget felis porttitor volutpat. Nulla quis lorem ut libero malesuada feugiat."",""field_type"":""text area"",""value"":""Praesent sapien massa, convallis a pellentesque nec, egestas non nisi. Sed porttitor lectus nibh. Pellentesque in ipsum id orci porta dapibus. Praesent sapien massa, convallis a pellentesque nec, egestas non nisi. Curabitur non nulla sit amet nisl tempus convallis quis ac lectus. Sed porttitor lectus nibh. Nulla quis lorem ut libero malesuada feugiat. Curabitur arcu erat, accumsan id imperdiet et, porttitor at sem. Vivamus suscipit tortor eget felis porttitor volutpat. Nulla quis lorem ut libero malesuada feugiat.""},{""field_name"":""More information Image"",""field_slug"":""product-other-description-more-information-image"",""field_help_text"":""Upload image here"",""field_default_text"":""Upload image here"",""field_type"":""photo upload"",""value"":""themes\/furnituremobileapp\/uploads\/36620221213_1670927150.png"",""image_path"":""themes\/furnituremobileapp\/uploads\/36620221213_1670927150.png""}]}]","{""product-other-description"":[{""field_type"":""text area"",""name"":""Other Description"",""value"":""Praesent sapien massa, convallis a pellentesque nec, egestas non nisi. Sed porttitor lectus nibh. Pellentesque in ipsum id orci porta dapibus. Praesent sapien massa, convallis a pellentesque nec, egestas non nisi. Curabitur non nulla sit amet nisl tempus convallis quis ac lectus. Sed porttitor lectus nibh. Nulla quis lorem ut libero malesuada feugiat. Curabitur arcu erat, accumsan id imperdiet et, porttitor at sem. Vivamus suscipit tortor eget felis porttitor volutpat. Nulla quis lorem ut libero malesuada feugiat.""},{""field_type"":""photo upload"",""name"":""Other Description Image"",""value"":""themes\/furnituremobileapp\/uploads\/11720221213_1670927150.png""},{""field_type"":""text area"",""name"":""More informations"",""value"":""Praesent sapien massa, convallis a pellentesque nec, egestas non nisi. Sed porttitor lectus nibh. Pellentesque in ipsum id orci porta dapibus. Praesent sapien massa, convallis a pellentesque nec, egestas non nisi. Curabitur non nulla sit amet nisl tempus convallis quis ac lectus. Sed porttitor lectus nibh. Nulla quis lorem ut libero malesuada feugiat. Curabitur arcu erat, accumsan id imperdiet et, porttitor at sem. Vivamus suscipit tortor eget felis porttitor volutpat. Nulla quis lorem ut libero malesuada feugiat.""},{""field_type"":""photo upload"",""name"":""More information Image"",""value"":""themes\/furnituremobileapp\/uploads\/36620221213_1670927150.png""}]}","[{""section_name"":""Product Tag"",""section_slug"":""product-tag"",""inner-list"":[{""field_name"":""new"",""field_slug"":""product-tag-new"",""field_help_text"":""new"",""field_default_text"":""new"",""field_type"":""radio""},{""field_name"":""best seller"",""field_slug"":""product-tag-best-seller"",""field_help_text"":""best seller"",""field_default_text"":""best seller"",""field_type"":""radio""},{""field_name"":""None"",""field_slug"":""product-tag-none"",""field_help_text"":""None"",""field_default_text"":""None"",""field_type"":""radio""}],""value"":""best seller""}]","best seller","81","0","themes/homedecor/uploads/08920221213_1670927150.png","https://apps.rajodiya.com/ecommerce/themes/homedecor/uploads/08920221213_1670927150.png","0.00","percentage","1.00","528","1","[""50""]","[{""attribute_id"":""50"",""values"":[""gray"",""blue"",""red""]}]","1345","0","2.00","Armless Swivel Desk Chair","homedecor","0",,,"2023-01-19 07:07:03","2023-01-19 07:07:03"
"845","Eastwood Slat Back Side Chair","Lorem Ipsum is simply dummy text of the printing and typesetting industry. Lorem Ipsum has been the industry's standard dummy.","[{""section_name"":""Product - Other Description"",""section_slug"":""product-other-description"",""inner-list"":[{""field_name"":""Other Description"",""field_slug"":""product-other-description-other-description"",""field_help_text"":""Please add your description text here"",""field_default_text"":""Praesent sapien massa, convallis a pellentesque nec, egestas non nisi. Sed porttitor lectus nibh. Pellentesque in ipsum id orci porta dapibus. Praesent sapien massa, convallis a pellentesque nec, egestas non nisi. Curabitur non nulla sit amet nisl tempus convallis quis ac lectus. Sed porttitor lectus nibh. Nulla quis lorem ut libero malesuada feugiat. Curabitur arcu erat, accumsan id imperdiet et, porttitor at sem. Vivamus suscipit tortor eget felis porttitor volutpat. Nulla quis lorem ut libero malesuada feugiat."",""field_type"":""text area"",""value"":""Praesent sapien massa, convallis a pellentesque nec, egestas non nisi. Sed porttitor lectus nibh. Pellentesque in ipsum id orci porta dapibus. Praesent sapien massa, convallis a pellentesque nec, egestas non nisi. Curabitur non nulla sit amet nisl tempus convallis quis ac lectus. Sed porttitor lectus nibh. Nulla quis lorem ut libero malesuada feugiat. Curabitur arcu erat, accumsan id imperdiet et, porttitor at sem. Vivamus suscipit tortor eget felis porttitor volutpat. Nulla quis lorem ut libero malesuada feugiat.""},{""field_name"":""Other Description Image"",""field_slug"":""product-other-description-other-description-image"",""field_help_text"":""Upload image here"",""field_default_text"":""Upload image here"",""field_type"":""photo upload"",""value"":""themes\/furnituremobileapp\/uploads\/11620221213_1670927197.png"",""image_path"":""themes\/furnituremobileapp\/uploads\/11620221213_1670927197.png""},{""field_name"":""More informations"",""field_slug"":""product-other-description-more-informations"",""field_help_text"":""Please add your description text here"",""field_default_text"":""Praesent sapien massa, convallis a pellentesque nec, egestas non nisi. Sed porttitor lectus nibh. Pellentesque in ipsum id orci porta dapibus. Praesent sapien massa, convallis a pellentesque nec, egestas non nisi. Curabitur non nulla sit amet nisl tempus convallis quis ac lectus. Sed porttitor lectus nibh. Nulla quis lorem ut libero malesuada feugiat. Curabitur arcu erat, accumsan id imperdiet et, porttitor at sem. Vivamus suscipit tortor eget felis porttitor volutpat. Nulla quis lorem ut libero malesuada feugiat."",""field_type"":""text area"",""value"":""Praesent sapien massa, convallis a pellentesque nec, egestas non nisi. Sed porttitor lectus nibh. Pellentesque in ipsum id orci porta dapibus. Praesent sapien massa, convallis a pellentesque nec, egestas non nisi. Curabitur non nulla sit amet nisl tempus convallis quis ac lectus. Sed porttitor lectus nibh. Nulla quis lorem ut libero malesuada feugiat. Curabitur arcu erat, accumsan id imperdiet et, porttitor at sem. Vivamus suscipit tortor eget felis porttitor volutpat. Nulla quis lorem ut libero malesuada feugiat.""},{""field_name"":""More information Image"",""field_slug"":""product-other-description-more-information-image"",""field_help_text"":""Upload image here"",""field_default_text"":""Upload image here"",""field_type"":""photo upload"",""value"":""themes\/furnituremobileapp\/uploads\/36320221213_1670927197.png"",""image_path"":""themes\/furnituremobileapp\/uploads\/36320221213_1670927197.png""}]}]","{""product-other-description"":[{""field_type"":""text area"",""name"":""Other Description"",""value"":""Praesent sapien massa, convallis a pellentesque nec, egestas non nisi. Sed porttitor lectus nibh. Pellentesque in ipsum id orci porta dapibus. Praesent sapien massa, convallis a pellentesque nec, egestas non nisi. Curabitur non nulla sit amet nisl tempus convallis quis ac lectus. Sed porttitor lectus nibh. Nulla quis lorem ut libero malesuada feugiat. Curabitur arcu erat, accumsan id imperdiet et, porttitor at sem. Vivamus suscipit tortor eget felis porttitor volutpat. Nulla quis lorem ut libero malesuada feugiat.""},{""field_type"":""photo upload"",""name"":""Other Description Image"",""value"":""themes\/furnituremobileapp\/uploads\/11620221213_1670927197.png""},{""field_type"":""text area"",""name"":""More informations"",""value"":""Praesent sapien massa, convallis a pellentesque nec, egestas non nisi. Sed porttitor lectus nibh. Pellentesque in ipsum id orci porta dapibus. Praesent sapien massa, convallis a pellentesque nec, egestas non nisi. Curabitur non nulla sit amet nisl tempus convallis quis ac lectus. Sed porttitor lectus nibh. Nulla quis lorem ut libero malesuada feugiat. Curabitur arcu erat, accumsan id imperdiet et, porttitor at sem. Vivamus suscipit tortor eget felis porttitor volutpat. Nulla quis lorem ut libero malesuada feugiat.""},{""field_type"":""photo upload"",""name"":""More information Image"",""value"":""themes\/furnituremobileapp\/uploads\/36320221213_1670927197.png""}]}","[{""section_name"":""Product Tag"",""section_slug"":""product-tag"",""inner-list"":[{""field_name"":""new"",""field_slug"":""product-tag-new"",""field_help_text"":""new"",""field_default_text"":""new"",""field_type"":""radio""},{""field_name"":""best seller"",""field_slug"":""product-tag-best-seller"",""field_help_text"":""best seller"",""field_default_text"":""best seller"",""field_type"":""radio""},{""field_name"":""None"",""field_slug"":""product-tag-none"",""field_help_text"":""None"",""field_default_text"":""None"",""field_type"":""radio""}],""value"":""best seller""}]","best seller","81","0","themes/homedecor/uploads/06120221213_1670927197.png","https://apps.rajodiya.com/ecommerce/themes/homedecor/uploads/06120221213_1670927197.png","300.00","percentage","1.00","269","0","NULL","NULL","0","1","0.00","eastwood_slat_back_side_chair","homedecor","0",,,"2023-01-19 07:07:03","2023-01-19 07:07:03"
"846","Finish Modern Loft Office Chair","Lorem Ipsum is simply dummy text of the printing and typesetting industry. Lorem Ipsum has been the industry's standard dummy.","[{""section_name"":""Product - Other Description"",""section_slug"":""product-other-description"",""inner-list"":[{""field_name"":""Other Description"",""field_slug"":""product-other-description-other-description"",""field_help_text"":""Please add your description text here"",""field_default_text"":""Praesent sapien massa, convallis a pellentesque nec, egestas non nisi. Sed porttitor lectus nibh. Pellentesque in ipsum id orci porta dapibus. Praesent sapien massa, convallis a pellentesque nec, egestas non nisi. Curabitur non nulla sit amet nisl tempus convallis quis ac lectus. Sed porttitor lectus nibh. Nulla quis lorem ut libero malesuada feugiat. Curabitur arcu erat, accumsan id imperdiet et, porttitor at sem. Vivamus suscipit tortor eget felis porttitor volutpat. Nulla quis lorem ut libero malesuada feugiat."",""field_type"":""text area"",""value"":""Praesent sapien massa, convallis a pellentesque nec, egestas non nisi. Sed porttitor lectus nibh. Pellentesque in ipsum id orci porta dapibus. Praesent sapien massa, convallis a pellentesque nec, egestas non nisi. Curabitur non nulla sit amet nisl tempus convallis quis ac lectus. Sed porttitor lectus nibh. Nulla quis lorem ut libero malesuada feugiat. Curabitur arcu erat, accumsan id imperdiet et, porttitor at sem. Vivamus suscipit tortor eget felis porttitor volutpat. Nulla quis lorem ut libero malesuada feugiat.""},{""field_name"":""Other Description Image"",""field_slug"":""product-other-description-other-description-image"",""field_help_text"":""Upload image here"",""field_default_text"":""Upload image here"",""field_type"":""photo upload"",""value"":""themes\/furnituremobileapp\/uploads\/13120221213_1670927243.png"",""image_path"":""themes\/furnituremobileapp\/uploads\/13120221213_1670927243.png""},{""field_name"":""More informations"",""field_slug"":""product-other-description-more-informations"",""field_help_text"":""Please add your description text here"",""field_default_text"":""Praesent sapien massa, convallis a pellentesque nec, egestas non nisi. Sed porttitor lectus nibh. Pellentesque in ipsum id orci porta dapibus. Praesent sapien massa, convallis a pellentesque nec, egestas non nisi. Curabitur non nulla sit amet nisl tempus convallis quis ac lectus. Sed porttitor lectus nibh. Nulla quis lorem ut libero malesuada feugiat. Curabitur arcu erat, accumsan id imperdiet et, porttitor at sem. Vivamus suscipit tortor eget felis porttitor volutpat. Nulla quis lorem ut libero malesuada feugiat."",""field_type"":""text area"",""value"":""Praesent sapien massa, convallis a pellentesque nec, egestas non nisi. Sed porttitor lectus nibh. Pellentesque in ipsum id orci porta dapibus. Praesent sapien massa, convallis a pellentesque nec, egestas non nisi. Curabitur non nulla sit amet nisl tempus convallis quis ac lectus. Sed porttitor lectus nibh. Nulla quis lorem ut libero malesuada feugiat. Curabitur arcu erat, accumsan id imperdiet et, porttitor at sem. Vivamus suscipit tortor eget felis porttitor volutpat. Nulla quis lorem ut libero malesuada feugiat.""},{""field_name"":""More information Image"",""field_slug"":""product-other-description-more-information-image"",""field_help_text"":""Upload image here"",""field_default_text"":""Upload image here"",""field_type"":""photo upload"",""value"":""themes\/furnituremobileapp\/uploads\/33820221213_1670927243.png"",""image_path"":""themes\/furnituremobileapp\/uploads\/33820221213_1670927243.png""}]}]","{""product-other-description"":[{""field_type"":""text area"",""name"":""Other Description"",""value"":""Praesent sapien massa, convallis a pellentesque nec, egestas non nisi. Sed porttitor lectus nibh. Pellentesque in ipsum id orci porta dapibus. Praesent sapien massa, convallis a pellentesque nec, egestas non nisi. Curabitur non nulla sit amet nisl tempus convallis quis ac lectus. Sed porttitor lectus nibh. Nulla quis lorem ut libero malesuada feugiat. Curabitur arcu erat, accumsan id imperdiet et, porttitor at sem. Vivamus suscipit tortor eget felis porttitor volutpat. Nulla quis lorem ut libero malesuada feugiat.""},{""field_type"":""photo upload"",""name"":""Other Description Image"",""value"":""themes\/furnituremobileapp\/uploads\/13120221213_1670927243.png""},{""field_type"":""text area"",""name"":""More informations"",""value"":""Praesent sapien massa, convallis a pellentesque nec, egestas non nisi. Sed porttitor lectus nibh. Pellentesque in ipsum id orci porta dapibus. Praesent sapien massa, convallis a pellentesque nec, egestas non nisi. Curabitur non nulla sit amet nisl tempus convallis quis ac lectus. Sed porttitor lectus nibh. Nulla quis lorem ut libero malesuada feugiat. Curabitur arcu erat, accumsan id imperdiet et, porttitor at sem. Vivamus suscipit tortor eget felis porttitor volutpat. Nulla quis lorem ut libero malesuada feugiat.""},{""field_type"":""photo upload"",""name"":""More information Image"",""value"":""themes\/furnituremobileapp\/uploads\/33820221213_1670927243.png""}]}","[{""section_name"":""Product Tag"",""section_slug"":""product-tag"",""inner-list"":[{""field_name"":""new"",""field_slug"":""product-tag-new"",""field_help_text"":""new"",""field_default_text"":""new"",""field_type"":""radio""},{""field_name"":""best seller"",""field_slug"":""product-tag-best-seller"",""field_help_text"":""best seller"",""field_default_text"":""best seller"",""field_type"":""radio""},{""field_name"":""None"",""field_slug"":""product-tag-none"",""field_help_text"":""None"",""field_default_text"":""None"",""field_type"":""radio""}],""value"":""None""}]","None","81","0","themes/homedecor/uploads/02120221213_1670927243.png","https://apps.rajodiya.com/ecommerce/themes/homedecor/uploads/02120221213_1670927243.png","400.00","percentage","1.00","196","0","NULL","NULL","0","0","0.00","finish_modern_loft_office_chair","homedecor","0",,,"2023-01-19 07:07:03","2023-01-19 07:07:03"
