1321,24 Carat Gold Plated Brass Wine Glasses,"Praesent sapien massa, convallis a pellentesque nec, egestas non nisi. Sed porttitor lectus nibh. Pellentesque in ipsum id orci porta dapibus. Praesent sapien massa, convallis a pellentesque nec, egestas non nisi. Curabitur non nulla sit amet nisl tempus convallis quis ac lectus. Sed porttitor lectus nibh. Nulla quis lorem ut libero malesuada feugiat. Curabitur arcu erat, accumsan id imperdiet et, porttitor at sem. Vivamus suscipit tortor eget felis porttitor volutpat. Nulla quis lorem ut libero malesuada feugiat.","[{""section_name"":""Product - Other Description"",""section_slug"":""product-other-description"",""inner-list"":[{""field_name"":""Other Description"",""field_slug"":""product-other-description-other-description"",""field_help_text"":""Please add your description text here"",""field_default_text"":""Praesent sapien massa, convallis a pellentesque nec, egestas non nisi. Sed porttitor lectus nibh. Pellentesque in ipsum id orci porta dapibus. Praesent sapien massa, convallis a pellentesque nec, egestas non nisi. Curabitur non nulla sit amet nisl tempus convallis quis ac lectus. Sed porttitor lectus nibh. Nulla quis lorem ut libero malesuada feugiat. Curabitur arcu erat, accumsan id imperdiet et, porttitor at sem. Vivamus suscipit tortor eget felis porttitor volutpat. Nulla quis lorem ut libero malesuada feugiat."",""field_type"":""text area"",""value"":""Praesent sapien massa, convallis a pellentesque nec, egestas non nisi. Sed porttitor lectus nibh. Pellentesque in ipsum id orci porta dapibus. Praesent sapien massa, convallis a pellentesque nec, egestas non nisi. Curabitur non nulla sit amet nisl tempus convallis quis ac lectus. Sed porttitor lectus nibh. Nulla quis lorem ut libero malesuada feugiat. Curabitur arcu erat, accumsan id imperdiet et, porttitor at sem. Vivamus suscipit tortor eget felis porttitor volutpat. Nulla quis lorem ut libero malesuada feugiat.""},{""field_name"":""Other Description Image"",""field_slug"":""product-other-description-other-description-image"",""field_help_text"":""Upload image here"",""field_default_text"":""Upload image here"",""field_type"":""photo upload"",""value"":""themes\/giftsforher\/uploads\/11_1674554637_1.png"",""image_path"":""themes\/giftsforher\/uploads\/11_1674554637_1.png""},{""field_name"":""More informations"",""field_slug"":""product-other-description-more-informations"",""field_help_text"":""Please add your description text here"",""field_default_text"":""Praesent sapien massa, convallis a pellentesque nec, egestas non nisi. Sed porttitor lectus nibh. Pellentesque in ipsum id orci porta dapibus. Praesent sapien massa, convallis a pellentesque nec, egestas non nisi. Curabitur non nulla sit amet nisl tempus convallis quis ac lectus. Sed porttitor lectus nibh. Nulla quis lorem ut libero malesuada feugiat. Curabitur arcu erat, accumsan id imperdiet et, porttitor at sem. Vivamus suscipit tortor eget felis porttitor volutpat. Nulla quis lorem ut libero malesuada feugiat."",""field_type"":""text area"",""value"":""Praesent sapien massa, convallis a pellentesque nec, egestas non nisi. Sed porttitor lectus nibh. Pellentesque in ipsum id orci porta dapibus. Praesent sapien massa, convallis a pellentesque nec, egestas non nisi. Curabitur non nulla sit amet nisl tempus convallis quis ac lectus. Sed porttitor lectus nibh. Nulla quis lorem ut libero malesuada feugiat. Curabitur arcu erat, accumsan id imperdiet et, porttitor at sem. Vivamus suscipit tortor eget felis porttitor volutpat. Nulla quis lorem ut libero malesuada feugiat.""},{""field_name"":""More information Image"",""field_slug"":""product-other-description-more-information-image"",""field_help_text"":""Upload image here"",""field_default_text"":""Upload image here"",""field_type"":""photo upload"",""value"":""themes\/giftsforher\/uploads\/74_1674554637_2.png"",""image_path"":""themes\/giftsforher\/uploads\/74_1674554637_2.png""}]}]","{""product-other-description"":[{""field_type"":""text area"",""name"":""Other Description"",""value"":""Praesent sapien massa, convallis a pellentesque nec, egestas non nisi. Sed porttitor lectus nibh. Pellentesque in ipsum id orci porta dapibus. Praesent sapien massa, convallis a pellentesque nec, egestas non nisi. Curabitur non nulla sit amet nisl tempus convallis quis ac lectus. Sed porttitor lectus nibh. Nulla quis lorem ut libero malesuada feugiat. Curabitur arcu erat, accumsan id imperdiet et, porttitor at sem. Vivamus suscipit tortor eget felis porttitor volutpat. Nulla quis lorem ut libero malesuada feugiat.""},{""field_type"":""photo upload"",""name"":""Other Description Image"",""value"":""themes\/giftsforher\/uploads\/11_1674554637_1.png""},{""field_type"":""text area"",""name"":""More informations"",""value"":""Praesent sapien massa, convallis a pellentesque nec, egestas non nisi. Sed porttitor lectus nibh. Pellentesque in ipsum id orci porta dapibus. Praesent sapien massa, convallis a pellentesque nec, egestas non nisi. Curabitur non nulla sit amet nisl tempus convallis quis ac lectus. Sed porttitor lectus nibh. Nulla quis lorem ut libero malesuada feugiat. Curabitur arcu erat, accumsan id imperdiet et, porttitor at sem. Vivamus suscipit tortor eget felis porttitor volutpat. Nulla quis lorem ut libero malesuada feugiat.""},{""field_type"":""photo upload"",""name"":""More information Image"",""value"":""themes\/giftsforher\/uploads\/74_1674554637_2.png""}]}","[{""section_name"":""Product Tag"",""section_slug"":""product-tag"",""inner-list"":[{""field_name"":""new"",""field_slug"":""product-tag-new"",""field_help_text"":""new"",""field_default_text"":""new"",""field_type"":""radio""},{""field_name"":""best seller"",""field_slug"":""product-tag-best-seller"",""field_help_text"":""best seller"",""field_default_text"":""best seller"",""field_type"":""radio""},{""field_name"":""None"",""field_slug"":""product-tag-none"",""field_help_text"":""None"",""field_default_text"":""None"",""field_type"":""radio""}],""value"":""None""}]",None,152,0,themes/giftsforher/uploads/37_1674554637_1.png,http://localhost/Ecommarce-dev2/themes/giftsforher/uploads/37_1674554637_1.png,0,percentage,10,200,1,"[""65""]","[{""attribute_id"":""65"",""values"":[""golden"",""silver""]}]",1874,1,0,24 Carat Gold Plated Brass Wine Glasses,giftsforher,1,,,2023-01-24 10:03:57,2023-01-24 10:05:10
1322,Crownlit Personalized 3 in 1 Metal Pen Set with Card,"Praesent sapien massa, convallis a pellentesque nec, egestas non nisi. Sed porttitor lectus nibh. Pellentesque in ipsum id orci porta dapibus. Praesent sapien massa, convallis a pellentesque nec, egestas non nisi. Curabitur non nulla sit amet nisl tempus convallis quis ac lectus. Sed porttitor lectus nibh. Nulla quis lorem ut libero malesuada feugiat. Curabitur arcu erat, accumsan id imperdiet et, porttitor at sem. Vivamus suscipit tortor eget felis porttitor volutpat. Nulla quis lorem ut libero malesuada feugiat.","[{""section_name"":""Product - Other Description"",""section_slug"":""product-other-description"",""inner-list"":[{""field_name"":""Other Description"",""field_slug"":""product-other-description-other-description"",""field_help_text"":""Please add your description text here"",""field_default_text"":""Praesent sapien massa, convallis a pellentesque nec, egestas non nisi. Sed porttitor lectus nibh. Pellentesque in ipsum id orci porta dapibus. Praesent sapien massa, convallis a pellentesque nec, egestas non nisi. Curabitur non nulla sit amet nisl tempus convallis quis ac lectus. Sed porttitor lectus nibh. Nulla quis lorem ut libero malesuada feugiat. Curabitur arcu erat, accumsan id imperdiet et, porttitor at sem. Vivamus suscipit tortor eget felis porttitor volutpat. Nulla quis lorem ut libero malesuada feugiat."",""field_type"":""text area"",""value"":""Praesent sapien massa, convallis a pellentesque nec, egestas non nisi. Sed porttitor lectus nibh. Pellentesque in ipsum id orci porta dapibus. Praesent sapien massa, convallis a pellentesque nec, egestas non nisi. Curabitur non nulla sit amet nisl tempus convallis quis ac lectus. Sed porttitor lectus nibh. Nulla quis lorem ut libero malesuada feugiat. Curabitur arcu erat, accumsan id imperdiet et, porttitor at sem. Vivamus suscipit tortor eget felis porttitor volutpat. Nulla quis lorem ut libero malesuada feugiat.""},{""field_name"":""Other Description Image"",""field_slug"":""product-other-description-other-description-image"",""field_help_text"":""Upload image here"",""field_default_text"":""Upload image here"",""field_type"":""photo upload"",""value"":""themes\/giftsforher\/uploads\/53_1674554794_1.png"",""image_path"":""themes\/giftsforher\/uploads\/53_1674554794_1.png""},{""field_name"":""More informations"",""field_slug"":""product-other-description-more-informations"",""field_help_text"":""Please add your description text here"",""field_default_text"":""Praesent sapien massa, convallis a pellentesque nec, egestas non nisi. Sed porttitor lectus nibh. Pellentesque in ipsum id orci porta dapibus. Praesent sapien massa, convallis a pellentesque nec, egestas non nisi. Curabitur non nulla sit amet nisl tempus convallis quis ac lectus. Sed porttitor lectus nibh. Nulla quis lorem ut libero malesuada feugiat. Curabitur arcu erat, accumsan id imperdiet et, porttitor at sem. Vivamus suscipit tortor eget felis porttitor volutpat. Nulla quis lorem ut libero malesuada feugiat."",""field_type"":""text area"",""value"":""Praesent sapien massa, convallis a pellentesque nec, egestas non nisi. Sed porttitor lectus nibh. Pellentesque in ipsum id orci porta dapibus. Praesent sapien massa, convallis a pellentesque nec, egestas non nisi. Curabitur non nulla sit amet nisl tempus convallis quis ac lectus. Sed porttitor lectus nibh. Nulla quis lorem ut libero malesuada feugiat. Curabitur arcu erat, accumsan id imperdiet et, porttitor at sem. Vivamus suscipit tortor eget felis porttitor volutpat. Nulla quis lorem ut libero malesuada feugiat.""},{""field_name"":""More information Image"",""field_slug"":""product-other-description-more-information-image"",""field_help_text"":""Upload image here"",""field_default_text"":""Upload image here"",""field_type"":""photo upload"",""value"":""themes\/giftsforher\/uploads\/97_1674554794_1.png"",""image_path"":""themes\/giftsforher\/uploads\/97_1674554794_1.png""}]}]","{""product-other-description"":[{""field_type"":""text area"",""name"":""Other Description"",""value"":""Praesent sapien massa, convallis a pellentesque nec, egestas non nisi. Sed porttitor lectus nibh. Pellentesque in ipsum id orci porta dapibus. Praesent sapien massa, convallis a pellentesque nec, egestas non nisi. Curabitur non nulla sit amet nisl tempus convallis quis ac lectus. Sed porttitor lectus nibh. Nulla quis lorem ut libero malesuada feugiat. Curabitur arcu erat, accumsan id imperdiet et, porttitor at sem. Vivamus suscipit tortor eget felis porttitor volutpat. Nulla quis lorem ut libero malesuada feugiat.""},{""field_type"":""photo upload"",""name"":""Other Description Image"",""value"":""themes\/giftsforher\/uploads\/53_1674554794_1.png""},{""field_type"":""text area"",""name"":""More informations"",""value"":""Praesent sapien massa, convallis a pellentesque nec, egestas non nisi. Sed porttitor lectus nibh. Pellentesque in ipsum id orci porta dapibus. Praesent sapien massa, convallis a pellentesque nec, egestas non nisi. Curabitur non nulla sit amet nisl tempus convallis quis ac lectus. Sed porttitor lectus nibh. Nulla quis lorem ut libero malesuada feugiat. Curabitur arcu erat, accumsan id imperdiet et, porttitor at sem. Vivamus suscipit tortor eget felis porttitor volutpat. Nulla quis lorem ut libero malesuada feugiat.""},{""field_type"":""photo upload"",""name"":""More information Image"",""value"":""themes\/giftsforher\/uploads\/97_1674554794_1.png""}]}","[{""section_name"":""Product Tag"",""section_slug"":""product-tag"",""inner-list"":[{""field_name"":""new"",""field_slug"":""product-tag-new"",""field_help_text"":""new"",""field_default_text"":""new"",""field_type"":""radio""},{""field_name"":""best seller"",""field_slug"":""product-tag-best-seller"",""field_help_text"":""best seller"",""field_default_text"":""best seller"",""field_type"":""radio""},{""field_name"":""None"",""field_slug"":""product-tag-none"",""field_help_text"":""None"",""field_default_text"":""None"",""field_type"":""radio""}],""value"":""new""}]",new,152,0,themes/giftsforher/uploads/100_1674554794_1.png,http://localhost/Ecommarce-dev2/themes/giftsforher/uploads/100_1674554794_1.png,650,percentage,10,152,0,NULL,NULL,0,1,3,crownlit_personalized_3_in_1_metal_pen_set_with_card,giftsforher,1,,,2023-01-24 10:06:34,2023-01-24 11:07:09
1323,Giftana Diwali Corporate Gift items for Employees,"Praesent sapien massa, convallis a pellentesque nec, egestas non nisi. Sed porttitor lectus nibh. Pellentesque in ipsum id orci porta dapibus. Praesent sapien massa, convallis a pellentesque nec, egestas non nisi. Curabitur non nulla sit amet nisl tempus convallis quis ac lectus. Sed porttitor lectus nibh. Nulla quis lorem ut libero malesuada feugiat. Curabitur arcu erat, accumsan id imperdiet et, porttitor at sem. Vivamus suscipit tortor eget felis porttitor volutpat. Nulla quis lorem ut libero malesuada feugiat.","[{""section_name"":""Product - Other Description"",""section_slug"":""product-other-description"",""inner-list"":[{""field_name"":""Other Description"",""field_slug"":""product-other-description-other-description"",""field_help_text"":""Please add your description text here"",""field_default_text"":""Praesent sapien massa, convallis a pellentesque nec, egestas non nisi. Sed porttitor lectus nibh. Pellentesque in ipsum id orci porta dapibus. Praesent sapien massa, convallis a pellentesque nec, egestas non nisi. Curabitur non nulla sit amet nisl tempus convallis quis ac lectus. Sed porttitor lectus nibh. Nulla quis lorem ut libero malesuada feugiat. Curabitur arcu erat, accumsan id imperdiet et, porttitor at sem. Vivamus suscipit tortor eget felis porttitor volutpat. Nulla quis lorem ut libero malesuada feugiat."",""field_type"":""text area"",""value"":""Praesent sapien massa, convallis a pellentesque nec, egestas non nisi. Sed porttitor lectus nibh. Pellentesque in ipsum id orci porta dapibus. Praesent sapien massa, convallis a pellentesque nec, egestas non nisi. Curabitur non nulla sit amet nisl tempus convallis quis ac lectus. Sed porttitor lectus nibh. Nulla quis lorem ut libero malesuada feugiat. Curabitur arcu erat, accumsan id imperdiet et, porttitor at sem. Vivamus suscipit tortor eget felis porttitor volutpat. Nulla quis lorem ut libero malesuada feugiat.""},{""field_name"":""Other Description Image"",""field_slug"":""product-other-description-other-description-image"",""field_help_text"":""Upload image here"",""field_default_text"":""Upload image here"",""field_type"":""photo upload"",""value"":""themes\/giftsforher\/uploads\/34_1674554848_1.png"",""image_path"":""themes\/giftsforher\/uploads\/34_1674554848_1.png""},{""field_name"":""More informations"",""field_slug"":""product-other-description-more-informations"",""field_help_text"":""Please add your description text here"",""field_default_text"":""Praesent sapien massa, convallis a pellentesque nec, egestas non nisi. Sed porttitor lectus nibh. Pellentesque in ipsum id orci porta dapibus. Praesent sapien massa, convallis a pellentesque nec, egestas non nisi. Curabitur non nulla sit amet nisl tempus convallis quis ac lectus. Sed porttitor lectus nibh. Nulla quis lorem ut libero malesuada feugiat. Curabitur arcu erat, accumsan id imperdiet et, porttitor at sem. Vivamus suscipit tortor eget felis porttitor volutpat. Nulla quis lorem ut libero malesuada feugiat."",""field_type"":""text area"",""value"":""Praesent sapien massa, convallis a pellentesque nec, egestas non nisi. Sed porttitor lectus nibh. Pellentesque in ipsum id orci porta dapibus. Praesent sapien massa, convallis a pellentesque nec, egestas non nisi. Curabitur non nulla sit amet nisl tempus convallis quis ac lectus. Sed porttitor lectus nibh. Nulla quis lorem ut libero malesuada feugiat. Curabitur arcu erat, accumsan id imperdiet et, porttitor at sem. Vivamus suscipit tortor eget felis porttitor volutpat. Nulla quis lorem ut libero malesuada feugiat.""},{""field_name"":""More information Image"",""field_slug"":""product-other-description-more-information-image"",""field_help_text"":""Upload image here"",""field_default_text"":""Upload image here"",""field_type"":""photo upload"",""value"":""themes\/giftsforher\/uploads\/80_1674554848_2.png"",""image_path"":""themes\/giftsforher\/uploads\/80_1674554848_2.png""}]}]","{""product-other-description"":[{""field_type"":""text area"",""name"":""Other Description"",""value"":""Praesent sapien massa, convallis a pellentesque nec, egestas non nisi. Sed porttitor lectus nibh. Pellentesque in ipsum id orci porta dapibus. Praesent sapien massa, convallis a pellentesque nec, egestas non nisi. Curabitur non nulla sit amet nisl tempus convallis quis ac lectus. Sed porttitor lectus nibh. Nulla quis lorem ut libero malesuada feugiat. Curabitur arcu erat, accumsan id imperdiet et, porttitor at sem. Vivamus suscipit tortor eget felis porttitor volutpat. Nulla quis lorem ut libero malesuada feugiat.""},{""field_type"":""photo upload"",""name"":""Other Description Image"",""value"":""themes\/giftsforher\/uploads\/34_1674554848_1.png""},{""field_type"":""text area"",""name"":""More informations"",""value"":""Praesent sapien massa, convallis a pellentesque nec, egestas non nisi. Sed porttitor lectus nibh. Pellentesque in ipsum id orci porta dapibus. Praesent sapien massa, convallis a pellentesque nec, egestas non nisi. Curabitur non nulla sit amet nisl tempus convallis quis ac lectus. Sed porttitor lectus nibh. Nulla quis lorem ut libero malesuada feugiat. Curabitur arcu erat, accumsan id imperdiet et, porttitor at sem. Vivamus suscipit tortor eget felis porttitor volutpat. Nulla quis lorem ut libero malesuada feugiat.""},{""field_type"":""photo upload"",""name"":""More information Image"",""value"":""themes\/giftsforher\/uploads\/80_1674554848_2.png""}]}","[{""section_name"":""Product Tag"",""section_slug"":""product-tag"",""inner-list"":[{""field_name"":""new"",""field_slug"":""product-tag-new"",""field_help_text"":""new"",""field_default_text"":""new"",""field_type"":""radio""},{""field_name"":""best seller"",""field_slug"":""product-tag-best-seller"",""field_help_text"":""best seller"",""field_default_text"":""best seller"",""field_type"":""radio""},{""field_name"":""None"",""field_slug"":""product-tag-none"",""field_help_text"":""None"",""field_default_text"":""None"",""field_type"":""radio""}],""value"":""new""}]",new,152,0,themes/giftsforher/uploads/75_1674554848_1.png,http://localhost/Ecommarce-dev2/themes/giftsforher/uploads/75_1674554848_1.png,0,percentage,10,0,1,"[""65""]","[{""attribute_id"":""65"",""values"":[""black"",""silver""]}]",1877,1,0,giftana_diwali_corporate_gift_items_for_employees,giftsforher,1,,,2023-01-24 10:07:28,2023-01-24 10:07:28
1324,Gold Playing Card,"Praesent sapien massa, convallis a pellentesque nec, egestas non nisi. Sed porttitor lectus nibh. Pellentesque in ipsum id orci porta dapibus. Praesent sapien massa, convallis a pellentesque nec, egestas non nisi. Curabitur non nulla sit amet nisl tempus convallis quis ac lectus. Sed porttitor lectus nibh. Nulla quis lorem ut libero malesuada feugiat. Curabitur arcu erat, accumsan id imperdiet et, porttitor at sem. Vivamus suscipit tortor eget felis porttitor volutpat. Nulla quis lorem ut libero malesuada feugiat.","[{""section_name"":""Product - Other Description"",""section_slug"":""product-other-description"",""inner-list"":[{""field_name"":""Other Description"",""field_slug"":""product-other-description-other-description"",""field_help_text"":""Please add your description text here"",""field_default_text"":""Praesent sapien massa, convallis a pellentesque nec, egestas non nisi. Sed porttitor lectus nibh. Pellentesque in ipsum id orci porta dapibus. Praesent sapien massa, convallis a pellentesque nec, egestas non nisi. Curabitur non nulla sit amet nisl tempus convallis quis ac lectus. Sed porttitor lectus nibh. Nulla quis lorem ut libero malesuada feugiat. Curabitur arcu erat, accumsan id imperdiet et, porttitor at sem. Vivamus suscipit tortor eget felis porttitor volutpat. Nulla quis lorem ut libero malesuada feugiat."",""field_type"":""text area"",""value"":""Praesent sapien massa, convallis a pellentesque nec, egestas non nisi. Sed porttitor lectus nibh. Pellentesque in ipsum id orci porta dapibus. Praesent sapien massa, convallis a pellentesque nec, egestas non nisi. Curabitur non nulla sit amet nisl tempus convallis quis ac lectus. Sed porttitor lectus nibh. Nulla quis lorem ut libero malesuada feugiat. Curabitur arcu erat, accumsan id imperdiet et, porttitor at sem. Vivamus suscipit tortor eget felis porttitor volutpat. Nulla quis lorem ut libero malesuada feugiat.""},{""field_name"":""Other Description Image"",""field_slug"":""product-other-description-other-description-image"",""field_help_text"":""Upload image here"",""field_default_text"":""Upload image here"",""field_type"":""photo upload"",""value"":""themes\/giftsforher\/uploads\/81_1674554895_1.png"",""image_path"":""themes\/giftsforher\/uploads\/81_1674554895_1.png""},{""field_name"":""More informations"",""field_slug"":""product-other-description-more-informations"",""field_help_text"":""Please add your description text here"",""field_default_text"":""Praesent sapien massa, convallis a pellentesque nec, egestas non nisi. Sed porttitor lectus nibh. Pellentesque in ipsum id orci porta dapibus. Praesent sapien massa, convallis a pellentesque nec, egestas non nisi. Curabitur non nulla sit amet nisl tempus convallis quis ac lectus. Sed porttitor lectus nibh. Nulla quis lorem ut libero malesuada feugiat. Curabitur arcu erat, accumsan id imperdiet et, porttitor at sem. Vivamus suscipit tortor eget felis porttitor volutpat. Nulla quis lorem ut libero malesuada feugiat."",""field_type"":""text area"",""value"":""Praesent sapien massa, convallis a pellentesque nec, egestas non nisi. Sed porttitor lectus nibh. Pellentesque in ipsum id orci porta dapibus. Praesent sapien massa, convallis a pellentesque nec, egestas non nisi. Curabitur non nulla sit amet nisl tempus convallis quis ac lectus. Sed porttitor lectus nibh. Nulla quis lorem ut libero malesuada feugiat. Curabitur arcu erat, accumsan id imperdiet et, porttitor at sem. Vivamus suscipit tortor eget felis porttitor volutpat. Nulla quis lorem ut libero malesuada feugiat.""},{""field_name"":""More information Image"",""field_slug"":""product-other-description-more-information-image"",""field_help_text"":""Upload image here"",""field_default_text"":""Upload image here"",""field_type"":""photo upload"",""value"":""themes\/giftsforher\/uploads\/97_1674554895_2.png"",""image_path"":""themes\/giftsforher\/uploads\/97_1674554895_2.png""}]}]","{""product-other-description"":[{""field_type"":""text area"",""name"":""Other Description"",""value"":""Praesent sapien massa, convallis a pellentesque nec, egestas non nisi. Sed porttitor lectus nibh. Pellentesque in ipsum id orci porta dapibus. Praesent sapien massa, convallis a pellentesque nec, egestas non nisi. Curabitur non nulla sit amet nisl tempus convallis quis ac lectus. Sed porttitor lectus nibh. Nulla quis lorem ut libero malesuada feugiat. Curabitur arcu erat, accumsan id imperdiet et, porttitor at sem. Vivamus suscipit tortor eget felis porttitor volutpat. Nulla quis lorem ut libero malesuada feugiat.""},{""field_type"":""photo upload"",""name"":""Other Description Image"",""value"":""themes\/giftsforher\/uploads\/81_1674554895_1.png""},{""field_type"":""text area"",""name"":""More informations"",""value"":""Praesent sapien massa, convallis a pellentesque nec, egestas non nisi. Sed porttitor lectus nibh. Pellentesque in ipsum id orci porta dapibus. Praesent sapien massa, convallis a pellentesque nec, egestas non nisi. Curabitur non nulla sit amet nisl tempus convallis quis ac lectus. Sed porttitor lectus nibh. Nulla quis lorem ut libero malesuada feugiat. Curabitur arcu erat, accumsan id imperdiet et, porttitor at sem. Vivamus suscipit tortor eget felis porttitor volutpat. Nulla quis lorem ut libero malesuada feugiat.""},{""field_type"":""photo upload"",""name"":""More information Image"",""value"":""themes\/giftsforher\/uploads\/97_1674554895_2.png""}]}","[{""section_name"":""Product Tag"",""section_slug"":""product-tag"",""inner-list"":[{""field_name"":""new"",""field_slug"":""product-tag-new"",""field_help_text"":""new"",""field_default_text"":""new"",""field_type"":""radio""},{""field_name"":""best seller"",""field_slug"":""product-tag-best-seller"",""field_help_text"":""best seller"",""field_default_text"":""best seller"",""field_type"":""radio""},{""field_name"":""None"",""field_slug"":""product-tag-none"",""field_help_text"":""None"",""field_default_text"":""None"",""field_type"":""radio""}],""value"":""best seller""}]",best seller,152,0,themes/giftsforher/uploads/77_1674554895_1.png,http://localhost/Ecommarce-dev2/themes/giftsforher/uploads/77_1674554895_1.png,250,percentage,10,124,0,NULL,NULL,0,1,0,gold_playing_card,giftsforher,1,,,2023-01-24 10:08:15,2023-01-24 10:08:15
