1345,watch titan,"Praesent sapien massa, convallis a pellentesque nec, egestas non nisi. Sed porttitor lectus nibh. Pellentesque in ipsum id orci porta dapibus. Praesent sapien massa, convallis a pellentesque nec, egestas non nisi. Curabitur non nulla sit amet nisl tempus convallis quis ac lectus. Sed porttitor lectus nibh. Nulla quis lorem ut libero malesuada feugiat. Curabitur arcu erat, accumsan id imperdiet et, porttitor at sem. Vivamus suscipit tortor eget felis porttitor volutpat. Nulla quis lorem ut libero malesuada feugiat.","[{""section_name"":""Product - Other Description"",""section_slug"":""product-other-description"",""inner-list"":[{""field_name"":""Other Description"",""field_slug"":""product-other-description-other-description"",""field_help_text"":""Please add your description text here"",""field_default_text"":""Praesent sapien massa, convallis a pellentesque nec, egestas non nisi. Sed porttitor lectus nibh. Pellentesque in ipsum id orci porta dapibus. Praesent sapien massa, convallis a pellentesque nec, egestas non nisi. Curabitur non nulla sit amet nisl tempus convallis quis ac lectus. Sed porttitor lectus nibh. Nulla quis lorem ut libero malesuada feugiat. Curabitur arcu erat, accumsan id imperdiet et, porttitor at sem. Vivamus suscipit tortor eget felis porttitor volutpat. Nulla quis lorem ut libero malesuada feugiat."",""field_type"":""text area"",""value"":""Praesent sapien massa, convallis a pellentesque nec, egestas non nisi. Sed porttitor lectus nibh. Pellentesque in ipsum id orci porta dapibus. Praesent sapien massa, convallis a pellentesque nec, egestas non nisi. Curabitur non nulla sit amet nisl tempus convallis quis ac lectus. Sed porttitor lectus nibh. Nulla quis lorem ut libero malesuada feugiat. Curabitur arcu erat, accumsan id imperdiet et, porttitor at sem. Vivamus suscipit tortor eget felis porttitor volutpat. Nulla quis lorem ut libero malesuada feugiat.""},{""field_name"":""Other Description Image"",""field_slug"":""product-other-description-other-description-image"",""field_help_text"":""Upload image here"",""field_default_text"":""Upload image here"",""field_type"":""photo upload"",""value"":""themes\/giftsforher\/uploads\/39_1674556447_1.png"",""image_path"":""themes\/giftsforher\/uploads\/39_1674556447_1.png""},{""field_name"":""More informations"",""field_slug"":""product-other-description-more-informations"",""field_help_text"":""Please add your description text here"",""field_default_text"":""Praesent sapien massa, convallis a pellentesque nec, egestas non nisi. Sed porttitor lectus nibh. Pellentesque in ipsum id orci porta dapibus. Praesent sapien massa, convallis a pellentesque nec, egestas non nisi. Curabitur non nulla sit amet nisl tempus convallis quis ac lectus. Sed porttitor lectus nibh. Nulla quis lorem ut libero malesuada feugiat. Curabitur arcu erat, accumsan id imperdiet et, porttitor at sem. Vivamus suscipit tortor eget felis porttitor volutpat. Nulla quis lorem ut libero malesuada feugiat."",""field_type"":""text area"",""value"":""Praesent sapien massa, convallis a pellentesque nec, egestas non nisi. Sed porttitor lectus nibh. Pellentesque in ipsum id orci porta dapibus. Praesent sapien massa, convallis a pellentesque nec, egestas non nisi. Curabitur non nulla sit amet nisl tempus convallis quis ac lectus. Sed porttitor lectus nibh. Nulla quis lorem ut libero malesuada feugiat. Curabitur arcu erat, accumsan id imperdiet et, porttitor at sem. Vivamus suscipit tortor eget felis porttitor volutpat. Nulla quis lorem ut libero malesuada feugiat.""},{""field_name"":""More information Image"",""field_slug"":""product-other-description-more-information-image"",""field_help_text"":""Upload image here"",""field_default_text"":""Upload image here"",""field_type"":""photo upload"",""value"":""themes\/giftsforher\/uploads\/76_1674556447_2.png"",""image_path"":""themes\/giftsforher\/uploads\/76_1674556447_2.png""}]}]","{""product-other-description"":[{""field_type"":""text area"",""name"":""Other Description"",""value"":""Praesent sapien massa, convallis a pellentesque nec, egestas non nisi. Sed porttitor lectus nibh. Pellentesque in ipsum id orci porta dapibus. Praesent sapien massa, convallis a pellentesque nec, egestas non nisi. Curabitur non nulla sit amet nisl tempus convallis quis ac lectus. Sed porttitor lectus nibh. Nulla quis lorem ut libero malesuada feugiat. Curabitur arcu erat, accumsan id imperdiet et, porttitor at sem. Vivamus suscipit tortor eget felis porttitor volutpat. Nulla quis lorem ut libero malesuada feugiat.""},{""field_type"":""photo upload"",""name"":""Other Description Image"",""value"":""themes\/giftsforher\/uploads\/39_1674556447_1.png""},{""field_type"":""text area"",""name"":""More informations"",""value"":""Praesent sapien massa, convallis a pellentesque nec, egestas non nisi. Sed porttitor lectus nibh. Pellentesque in ipsum id orci porta dapibus. Praesent sapien massa, convallis a pellentesque nec, egestas non nisi. Curabitur non nulla sit amet nisl tempus convallis quis ac lectus. Sed porttitor lectus nibh. Nulla quis lorem ut libero malesuada feugiat. Curabitur arcu erat, accumsan id imperdiet et, porttitor at sem. Vivamus suscipit tortor eget felis porttitor volutpat. Nulla quis lorem ut libero malesuada feugiat.""},{""field_type"":""photo upload"",""name"":""More information Image"",""value"":""themes\/giftsforher\/uploads\/76_1674556447_2.png""}]}","[{""section_name"":""Product Tag"",""section_slug"":""product-tag"",""inner-list"":[{""field_name"":""new"",""field_slug"":""product-tag-new"",""field_help_text"":""new"",""field_default_text"":""new"",""field_type"":""radio""},{""field_name"":""best seller"",""field_slug"":""product-tag-best-seller"",""field_help_text"":""best seller"",""field_default_text"":""best seller"",""field_type"":""radio""},{""field_name"":""None"",""field_slug"":""product-tag-none"",""field_help_text"":""None"",""field_default_text"":""None"",""field_type"":""radio""}],""value"":""None""}]",None,155,0,themes/giftsforher/uploads/27_1674556447_1.png,http://localhost/Ecommarce-dev2/themes/giftsforher/uploads/27_1674556447_1.png,850,percentage,10,100,0,NULL,NULL,0,1,0,watch_titan,giftsforher,1,,,2023-01-24 10:34:07,2023-01-24 10:34:07
1346,Big Dipper Ring,"Praesent sapien massa, convallis a pellentesque nec, egestas non nisi. Sed porttitor lectus nibh. Pellentesque in ipsum id orci porta dapibus. Praesent sapien massa, convallis a pellentesque nec, egestas non nisi. Curabitur non nulla sit amet nisl tempus convallis quis ac lectus. Sed porttitor lectus nibh. Nulla quis lorem ut libero malesuada feugiat. Curabitur arcu erat, accumsan id imperdiet et, porttitor at sem. Vivamus suscipit tortor eget felis porttitor volutpat. Nulla quis lorem ut libero malesuada feugiat.","[{""section_name"":""Product - Other Description"",""section_slug"":""product-other-description"",""inner-list"":[{""field_name"":""Other Description"",""field_slug"":""product-other-description-other-description"",""field_help_text"":""Please add your description text here"",""field_default_text"":""Praesent sapien massa, convallis a pellentesque nec, egestas non nisi. Sed porttitor lectus nibh. Pellentesque in ipsum id orci porta dapibus. Praesent sapien massa, convallis a pellentesque nec, egestas non nisi. Curabitur non nulla sit amet nisl tempus convallis quis ac lectus. Sed porttitor lectus nibh. Nulla quis lorem ut libero malesuada feugiat. Curabitur arcu erat, accumsan id imperdiet et, porttitor at sem. Vivamus suscipit tortor eget felis porttitor volutpat. Nulla quis lorem ut libero malesuada feugiat."",""field_type"":""text area"",""value"":""Praesent sapien massa, convallis a pellentesque nec, egestas non nisi. Sed porttitor lectus nibh. Pellentesque in ipsum id orci porta dapibus. Praesent sapien massa, convallis a pellentesque nec, egestas non nisi. Curabitur non nulla sit amet nisl tempus convallis quis ac lectus. Sed porttitor lectus nibh. Nulla quis lorem ut libero malesuada feugiat. Curabitur arcu erat, accumsan id imperdiet et, porttitor at sem. Vivamus suscipit tortor eget felis porttitor volutpat. Nulla quis lorem ut libero malesuada feugiat.""},{""field_name"":""Other Description Image"",""field_slug"":""product-other-description-other-description-image"",""field_help_text"":""Upload image here"",""field_default_text"":""Upload image here"",""field_type"":""photo upload"",""value"":""themes\/giftsforher\/uploads\/53_1674556522_2.png"",""image_path"":""themes\/giftsforher\/uploads\/53_1674556522_2.png""},{""field_name"":""More informations"",""field_slug"":""product-other-description-more-informations"",""field_help_text"":""Please add your description text here"",""field_default_text"":""Praesent sapien massa, convallis a pellentesque nec, egestas non nisi. Sed porttitor lectus nibh. Pellentesque in ipsum id orci porta dapibus. Praesent sapien massa, convallis a pellentesque nec, egestas non nisi. Curabitur non nulla sit amet nisl tempus convallis quis ac lectus. Sed porttitor lectus nibh. Nulla quis lorem ut libero malesuada feugiat. Curabitur arcu erat, accumsan id imperdiet et, porttitor at sem. Vivamus suscipit tortor eget felis porttitor volutpat. Nulla quis lorem ut libero malesuada feugiat."",""field_type"":""text area"",""value"":""Praesent sapien massa, convallis a pellentesque nec, egestas non nisi. Sed porttitor lectus nibh. Pellentesque in ipsum id orci porta dapibus. Praesent sapien massa, convallis a pellentesque nec, egestas non nisi. Curabitur non nulla sit amet nisl tempus convallis quis ac lectus. Sed porttitor lectus nibh. Nulla quis lorem ut libero malesuada feugiat. Curabitur arcu erat, accumsan id imperdiet et, porttitor at sem. Vivamus suscipit tortor eget felis porttitor volutpat. Nulla quis lorem ut libero malesuada feugiat.""},{""field_name"":""More information Image"",""field_slug"":""product-other-description-more-information-image"",""field_help_text"":""Upload image here"",""field_default_text"":""Upload image here"",""field_type"":""photo upload"",""value"":""themes\/giftsforher\/uploads\/29_1674556522_2.png"",""image_path"":""themes\/giftsforher\/uploads\/29_1674556522_2.png""}]}]","{""product-other-description"":[{""field_type"":""text area"",""name"":""Other Description"",""value"":""Praesent sapien massa, convallis a pellentesque nec, egestas non nisi. Sed porttitor lectus nibh. Pellentesque in ipsum id orci porta dapibus. Praesent sapien massa, convallis a pellentesque nec, egestas non nisi. Curabitur non nulla sit amet nisl tempus convallis quis ac lectus. Sed porttitor lectus nibh. Nulla quis lorem ut libero malesuada feugiat. Curabitur arcu erat, accumsan id imperdiet et, porttitor at sem. Vivamus suscipit tortor eget felis porttitor volutpat. Nulla quis lorem ut libero malesuada feugiat.""},{""field_type"":""photo upload"",""name"":""Other Description Image"",""value"":""themes\/giftsforher\/uploads\/53_1674556522_2.png""},{""field_type"":""text area"",""name"":""More informations"",""value"":""Praesent sapien massa, convallis a pellentesque nec, egestas non nisi. Sed porttitor lectus nibh. Pellentesque in ipsum id orci porta dapibus. Praesent sapien massa, convallis a pellentesque nec, egestas non nisi. Curabitur non nulla sit amet nisl tempus convallis quis ac lectus. Sed porttitor lectus nibh. Nulla quis lorem ut libero malesuada feugiat. Curabitur arcu erat, accumsan id imperdiet et, porttitor at sem. Vivamus suscipit tortor eget felis porttitor volutpat. Nulla quis lorem ut libero malesuada feugiat.""},{""field_type"":""photo upload"",""name"":""More information Image"",""value"":""themes\/giftsforher\/uploads\/29_1674556522_2.png""}]}","[{""section_name"":""Product Tag"",""section_slug"":""product-tag"",""inner-list"":[{""field_name"":""new"",""field_slug"":""product-tag-new"",""field_help_text"":""new"",""field_default_text"":""new"",""field_type"":""radio""},{""field_name"":""best seller"",""field_slug"":""product-tag-best-seller"",""field_help_text"":""best seller"",""field_default_text"":""best seller"",""field_type"":""radio""},{""field_name"":""None"",""field_slug"":""product-tag-none"",""field_help_text"":""None"",""field_default_text"":""None"",""field_type"":""radio""}],""value"":""None""}]",None,156,0,themes/giftsforher/uploads/57_1674556522_1.png,http://localhost/Ecommarce-dev2/themes/giftsforher/uploads/57_1674556522_1.png,0,flat,10,0,1,"[""65""]","[{""attribute_id"":""65"",""values"":[""silver"",""golden""]}]",1895,1,0,big_dipper_ring,giftsforher,1,,,2023-01-24 10:35:22,2023-01-24 10:35:22
1348,Crown of Waves Ring,"Praesent sapien massa, convallis a pellentesque nec, egestas non nisi. Sed porttitor lectus nibh. Pellentesque in ipsum id orci porta dapibus. Praesent sapien massa, convallis a pellentesque nec, egestas non nisi. Curabitur non nulla sit amet nisl tempus convallis quis ac lectus. Sed porttitor lectus nibh. Nulla quis lorem ut libero malesuada feugiat. Curabitur arcu erat, accumsan id imperdiet et, porttitor at sem. Vivamus suscipit tortor eget felis porttitor volutpat. Nulla quis lorem ut libero malesuada feugiat.","[{""section_name"":""Product - Other Description"",""section_slug"":""product-other-description"",""inner-list"":[{""field_name"":""Other Description"",""field_slug"":""product-other-description-other-description"",""field_help_text"":""Please add your description text here"",""field_default_text"":""Praesent sapien massa, convallis a pellentesque nec, egestas non nisi. Sed porttitor lectus nibh. Pellentesque in ipsum id orci porta dapibus. Praesent sapien massa, convallis a pellentesque nec, egestas non nisi. Curabitur non nulla sit amet nisl tempus convallis quis ac lectus. Sed porttitor lectus nibh. Nulla quis lorem ut libero malesuada feugiat. Curabitur arcu erat, accumsan id imperdiet et, porttitor at sem. Vivamus suscipit tortor eget felis porttitor volutpat. Nulla quis lorem ut libero malesuada feugiat."",""field_type"":""text area"",""value"":""Praesent sapien massa, convallis a pellentesque nec, egestas non nisi. Sed porttitor lectus nibh. Pellentesque in ipsum id orci porta dapibus. Praesent sapien massa, convallis a pellentesque nec, egestas non nisi. Curabitur non nulla sit amet nisl tempus convallis quis ac lectus. Sed porttitor lectus nibh. Nulla quis lorem ut libero malesuada feugiat. Curabitur arcu erat, accumsan id imperdiet et, porttitor at sem. Vivamus suscipit tortor eget felis porttitor volutpat. Nulla quis lorem ut libero malesuada feugiat.""},{""field_name"":""Other Description Image"",""field_slug"":""product-other-description-other-description-image"",""field_help_text"":""Upload image here"",""field_default_text"":""Upload image here"",""field_type"":""photo upload"",""value"":""themes\/giftsforher\/uploads\/64_1674556625_2.png"",""image_path"":""themes\/giftsforher\/uploads\/64_1674556625_2.png""},{""field_name"":""More informations"",""field_slug"":""product-other-description-more-informations"",""field_help_text"":""Please add your description text here"",""field_default_text"":""Praesent sapien massa, convallis a pellentesque nec, egestas non nisi. Sed porttitor lectus nibh. Pellentesque in ipsum id orci porta dapibus. Praesent sapien massa, convallis a pellentesque nec, egestas non nisi. Curabitur non nulla sit amet nisl tempus convallis quis ac lectus. Sed porttitor lectus nibh. Nulla quis lorem ut libero malesuada feugiat. Curabitur arcu erat, accumsan id imperdiet et, porttitor at sem. Vivamus suscipit tortor eget felis porttitor volutpat. Nulla quis lorem ut libero malesuada feugiat."",""field_type"":""text area"",""value"":""Praesent sapien massa, convallis a pellentesque nec, egestas non nisi. Sed porttitor lectus nibh. Pellentesque in ipsum id orci porta dapibus. Praesent sapien massa, convallis a pellentesque nec, egestas non nisi. Curabitur non nulla sit amet nisl tempus convallis quis ac lectus. Sed porttitor lectus nibh. Nulla quis lorem ut libero malesuada feugiat. Curabitur arcu erat, accumsan id imperdiet et, porttitor at sem. Vivamus suscipit tortor eget felis porttitor volutpat. Nulla quis lorem ut libero malesuada feugiat.""},{""field_name"":""More information Image"",""field_slug"":""product-other-description-more-information-image"",""field_help_text"":""Upload image here"",""field_default_text"":""Upload image here"",""field_type"":""photo upload"",""value"":""themes\/giftsforher\/uploads\/42_1674556625_3.png"",""image_path"":""themes\/giftsforher\/uploads\/42_1674556625_3.png""}]}]","{""product-other-description"":[{""field_type"":""text area"",""name"":""Other Description"",""value"":""Praesent sapien massa, convallis a pellentesque nec, egestas non nisi. Sed porttitor lectus nibh. Pellentesque in ipsum id orci porta dapibus. Praesent sapien massa, convallis a pellentesque nec, egestas non nisi. Curabitur non nulla sit amet nisl tempus convallis quis ac lectus. Sed porttitor lectus nibh. Nulla quis lorem ut libero malesuada feugiat. Curabitur arcu erat, accumsan id imperdiet et, porttitor at sem. Vivamus suscipit tortor eget felis porttitor volutpat. Nulla quis lorem ut libero malesuada feugiat.""},{""field_type"":""photo upload"",""name"":""Other Description Image"",""value"":""themes\/giftsforher\/uploads\/64_1674556625_2.png""},{""field_type"":""text area"",""name"":""More informations"",""value"":""Praesent sapien massa, convallis a pellentesque nec, egestas non nisi. Sed porttitor lectus nibh. Pellentesque in ipsum id orci porta dapibus. Praesent sapien massa, convallis a pellentesque nec, egestas non nisi. Curabitur non nulla sit amet nisl tempus convallis quis ac lectus. Sed porttitor lectus nibh. Nulla quis lorem ut libero malesuada feugiat. Curabitur arcu erat, accumsan id imperdiet et, porttitor at sem. Vivamus suscipit tortor eget felis porttitor volutpat. Nulla quis lorem ut libero malesuada feugiat.""},{""field_type"":""photo upload"",""name"":""More information Image"",""value"":""themes\/giftsforher\/uploads\/42_1674556625_3.png""}]}","[{""section_name"":""Product Tag"",""section_slug"":""product-tag"",""inner-list"":[{""field_name"":""new"",""field_slug"":""product-tag-new"",""field_help_text"":""new"",""field_default_text"":""new"",""field_type"":""radio""},{""field_name"":""best seller"",""field_slug"":""product-tag-best-seller"",""field_help_text"":""best seller"",""field_default_text"":""best seller"",""field_type"":""radio""},{""field_name"":""None"",""field_slug"":""product-tag-none"",""field_help_text"":""None"",""field_default_text"":""None"",""field_type"":""radio""}],""value"":""new""}]",new,156,0,themes/giftsforher/uploads/67_1674556625_1.png,http://localhost/Ecommarce-dev2/themes/giftsforher/uploads/67_1674556625_1.png,0,percentage,10,0,1,"[""65""]","[{""attribute_id"":""65"",""values"":[""silver"",""golden""]}]",1897,1,0,crown_of_waves_ring,giftsforher,1,,,2023-01-24 10:37:05,2023-01-24 10:37:05
1349,Downhill Ski & Snowboard,"Praesent sapien massa, convallis a pellentesque nec, egestas non nisi. Sed porttitor lectus nibh. Pellentesque in ipsum id orci porta dapibus. Praesent sapien massa, convallis a pellentesque nec, egestas non nisi. Curabitur non nulla sit amet nisl tempus convallis quis ac lectus. Sed porttitor lectus nibh. Nulla quis lorem ut libero malesuada feugiat. Curabitur arcu erat, accumsan id imperdiet et, porttitor at sem. Vivamus suscipit tortor eget felis porttitor volutpat. Nulla quis lorem ut libero malesuada feugiat.","[{""section_name"":""Product - Other Description"",""section_slug"":""product-other-description"",""inner-list"":[{""field_name"":""Other Description"",""field_slug"":""product-other-description-other-description"",""field_help_text"":""Please add your description text here"",""field_default_text"":""Praesent sapien massa, convallis a pellentesque nec, egestas non nisi. Sed porttitor lectus nibh. Pellentesque in ipsum id orci porta dapibus. Praesent sapien massa, convallis a pellentesque nec, egestas non nisi. Curabitur non nulla sit amet nisl tempus convallis quis ac lectus. Sed porttitor lectus nibh. Nulla quis lorem ut libero malesuada feugiat. Curabitur arcu erat, accumsan id imperdiet et, porttitor at sem. Vivamus suscipit tortor eget felis porttitor volutpat. Nulla quis lorem ut libero malesuada feugiat."",""field_type"":""text area"",""value"":""Praesent sapien massa, convallis a pellentesque nec, egestas non nisi. Sed porttitor lectus nibh. Pellentesque in ipsum id orci porta dapibus. Praesent sapien massa, convallis a pellentesque nec, egestas non nisi. Curabitur non nulla sit amet nisl tempus convallis quis ac lectus. Sed porttitor lectus nibh. Nulla quis lorem ut libero malesuada feugiat. Curabitur arcu erat, accumsan id imperdiet et, porttitor at sem. Vivamus suscipit tortor eget felis porttitor volutpat. Nulla quis lorem ut libero malesuada feugiat.""},{""field_name"":""Other Description Image"",""field_slug"":""product-other-description-other-description-image"",""field_help_text"":""Upload image here"",""field_default_text"":""Upload image here"",""field_type"":""photo upload"",""value"":""themes\/giftsforher\/uploads\/21_1674556680_1.png"",""image_path"":""themes\/giftsforher\/uploads\/21_1674556680_1.png""},{""field_name"":""More informations"",""field_slug"":""product-other-description-more-informations"",""field_help_text"":""Please add your description text here"",""field_default_text"":""Praesent sapien massa, convallis a pellentesque nec, egestas non nisi. Sed porttitor lectus nibh. Pellentesque in ipsum id orci porta dapibus. Praesent sapien massa, convallis a pellentesque nec, egestas non nisi. Curabitur non nulla sit amet nisl tempus convallis quis ac lectus. Sed porttitor lectus nibh. Nulla quis lorem ut libero malesuada feugiat. Curabitur arcu erat, accumsan id imperdiet et, porttitor at sem. Vivamus suscipit tortor eget felis porttitor volutpat. Nulla quis lorem ut libero malesuada feugiat."",""field_type"":""text area"",""value"":""Praesent sapien massa, convallis a pellentesque nec, egestas non nisi. Sed porttitor lectus nibh. Pellentesque in ipsum id orci porta dapibus. Praesent sapien massa, convallis a pellentesque nec, egestas non nisi. Curabitur non nulla sit amet nisl tempus convallis quis ac lectus. Sed porttitor lectus nibh. Nulla quis lorem ut libero malesuada feugiat. Curabitur arcu erat, accumsan id imperdiet et, porttitor at sem. Vivamus suscipit tortor eget felis porttitor volutpat. Nulla quis lorem ut libero malesuada feugiat.""},{""field_name"":""More information Image"",""field_slug"":""product-other-description-more-information-image"",""field_help_text"":""Upload image here"",""field_default_text"":""Upload image here"",""field_type"":""photo upload"",""value"":""themes\/giftsforher\/uploads\/70_1674556680_2.png"",""image_path"":""themes\/giftsforher\/uploads\/70_1674556680_2.png""}]}]","{""product-other-description"":[{""field_type"":""text area"",""name"":""Other Description"",""value"":""Praesent sapien massa, convallis a pellentesque nec, egestas non nisi. Sed porttitor lectus nibh. Pellentesque in ipsum id orci porta dapibus. Praesent sapien massa, convallis a pellentesque nec, egestas non nisi. Curabitur non nulla sit amet nisl tempus convallis quis ac lectus. Sed porttitor lectus nibh. Nulla quis lorem ut libero malesuada feugiat. Curabitur arcu erat, accumsan id imperdiet et, porttitor at sem. Vivamus suscipit tortor eget felis porttitor volutpat. Nulla quis lorem ut libero malesuada feugiat.""},{""field_type"":""photo upload"",""name"":""Other Description Image"",""value"":""themes\/giftsforher\/uploads\/21_1674556680_1.png""},{""field_type"":""text area"",""name"":""More informations"",""value"":""Praesent sapien massa, convallis a pellentesque nec, egestas non nisi. Sed porttitor lectus nibh. Pellentesque in ipsum id orci porta dapibus. Praesent sapien massa, convallis a pellentesque nec, egestas non nisi. Curabitur non nulla sit amet nisl tempus convallis quis ac lectus. Sed porttitor lectus nibh. Nulla quis lorem ut libero malesuada feugiat. Curabitur arcu erat, accumsan id imperdiet et, porttitor at sem. Vivamus suscipit tortor eget felis porttitor volutpat. Nulla quis lorem ut libero malesuada feugiat.""},{""field_type"":""photo upload"",""name"":""More information Image"",""value"":""themes\/giftsforher\/uploads\/70_1674556680_2.png""}]}","[{""section_name"":""Product Tag"",""section_slug"":""product-tag"",""inner-list"":[{""field_name"":""new"",""field_slug"":""product-tag-new"",""field_help_text"":""new"",""field_default_text"":""new"",""field_type"":""radio""},{""field_name"":""best seller"",""field_slug"":""product-tag-best-seller"",""field_help_text"":""best seller"",""field_default_text"":""best seller"",""field_type"":""radio""},{""field_name"":""None"",""field_slug"":""product-tag-none"",""field_help_text"":""None"",""field_default_text"":""None"",""field_type"":""radio""}],""value"":""best seller""}]",best seller,156,0,themes/giftsforher/uploads/43_1674556680_2.png,http://localhost/Ecommarce-dev2/themes/giftsforher/uploads/43_1674556680_2.png,450,percentage,10,120,0,NULL,NULL,0,1,2,downhill_ski_&_snowboard,giftsforher,1,,,2023-01-24 10:38:00,2023-01-24 11:06:12
